{"content":{"circuit_id":"circuit:rc-low-pass-v1","components":[{"id":"component:c-filter","kind":"capacitor_unpolarized","reference":"C1","value":"100n"},{"id":"component:r-input","kind":"resistor","reference":"R1","value":"1k"}],"nets":[{"connections":[{"component_id":"component:r-input","pin":"1"}],"id":"net:audio-in","name":"AUDIO_IN"},{"connections":[{"component_id":"component:c-filter","pin":"1"},{"component_id":"component:r-input","pin":"2"}],"id":"net:audio-out","name":"AUDIO_OUT"},{"connections":[{"component_id":"component:c-filter","pin":"2"}],"id":"net:gnd","name":"GND"}],"ports":[{"direction":"input","id":"port:audio-in","net_id":"net:audio-in"},{"direction":"output","id":"port:audio-out","net_id":"net:audio-out"},{"direction":"passive","id":"port:gnd","net_id":"net:gnd"}],"project_name":"rc-low-pass-v1","title":"Original low-voltage RC audio low-pass intent"},"schema":"copper.circuit-intent","schema_version":"0.1.0","snapshot_digest":"sha256:06383cabd428aa52585b1e0f0c82dea6e6f434e55d154f6d2ee87e3879f49795"}
